{"$schema":"https://json-schema.org/draft/2020-12/schema","$id":"checkpoint-5f-execution-evidence.schema.json","type":"object","additionalProperties":false,"required":["schema_version","renderer","render_manifests","render_critic_reports","image_capable_review","current_slide_context","review_actions"],"properties":{"schema_version":{"const":"1.0.0"},"renderer":{"type":"object"},"render_manifests":{"type":"array"},"render_critic_reports":{"type":"array"},"image_capable_review":{"type":"object"},"current_slide_context":{"type":"object"},"review_actions":{"type":"array"}}}
